Text,Keyword,Color,Emotion,Sentiment
Love is the most healing emotion wholeheartedly.,Love,Pink,Love,Positive
Love is the most uplifting emotion abundantly.,Love,Pink,Love,Positive
Love is the most fulfilling emotion eternally.,Love,Pink,Love,Positive
I envy her effortless beauty and charm.,envy,Green,Envy,Negative
I begrudge their luxurious lifestyle and endless vacations.,begrudge,Green,Envy,Negative
I covet their prestigious career and remarkable achievements.,covet,Green,Envy,Negative
I yearn for their effortless success and abundant wealth.,yearn,Green,Envy,Negative
I crave their captivating talents and artistic brilliance.,crave,Green,Envy,Negative
I long for their harmonious relationships and supportive family.,long,Green,Envy,Negative
I desire their unwavering confidence and unshakeable self-belief.,desire,Green,Envy,Negative
I resent their seemingly perfect lives and effortless happiness.,resent,Green,Envy,Negative
I am envious of their carefree spirit and boundless energy.,envious,Green,Envy,Negative
I covet their jet-setting lifestyle and exotic adventures.,covet,Green,Envy,Negative
I long for their ability to travel the world and experience different cultures.,long,Green,Envy,Negative
I envy their courage to pursue their dreams and live life to the fullest.,envy,Green,Envy,Negative
I crave their zest for life and unwavering optimism.,crave,Green,Envy,Negative
I resent their easygoing nature and ability to handle stress with grace.,resent,Green,Envy,Negative
I covet their close-knit group of friends and unwavering support system.,covet,Green,Envy,Negative
"I envy their ability to connect with people and form deep, meaningful relationships.",envy,Green,Envy,Negative
I long for their ability to make others feel valued and appreciated.,long,Green,Envy,Negative
I crave their infectious laughter and ability to bring joy to others.,crave,Green,Envy,Negative
I resent their seemingly perfect social life and ability to make friends effortlessly.,resent,Green,Envy,Negative
I covet their ability to light up a room with their presence and charisma.,covet,Green,Envy,Negative
"I envy their intelligence, wit, and ability to hold engaging conversations.",envy,Green,Envy,Negative
I long for their ability to learn and retain information with ease.,long,Green,Envy,Negative
"I crave their creativity and ability to express themselves through art, music, or writing.",crave,Green,Envy,Negative
I resent their seemingly effortless academic achievements and intellectual prowess.,resent,Green,Envy,Negative
I covet their ability to solve complex problems and think outside the box.,covet,Green,Envy,Negative
I envy their physical fitness and athletic prowess.,envy,Green,Envy,Negative
I long for their healthy lifestyle and ability to maintain a healthy weight.,long,Green,Envy,Negative
I crave their ability to feel comfortable and confident in their own skin.,crave,Green,Envy,Negative
I resent their seemingly effortless ability to stay fit and active.,resent,Green,Envy,Negative
I covet their glowing complexion and radiant beauty.,covet,Green,Envy,Negative
I envy their sense of style and ability to put together a fashionable outfit.,envy,Green,Envy,Negative
I long for their ability to express themselves through their clothing choices.,long,Green,Envy,Negative
I crave their confidence to experiment with different styles and trends.,crave,Green,Envy,Negative
I resent their seemingly effortless ability to look good in anything they wear.,resent,Green,Envy,Negative
I covet their ability to accessorize with flair and add a touch of personality to their outfits.,covet,Green,Envy,Negative
I envy their ability to make a lasting impression with their appearance.,envy,Green,Envy,Negative
I long for their ability to feel comfortable and stylish in their own skin.,long,Green,Envy,Negative
I crave their confidence to carry themselves with elegance and grace.,crave,Green,Envy,Negative
I resent their seemingly effortless ability to always look put-together and polished.,resent,Green,Envy,Negative
I covet their ability to make a statement with their fashion choices.,covet,Green,Envy,Negative
I envy their sense of adventure and willingness to step outside their comfort zone.,envy,Green,Envy,Negative
I long for their courage to try new things and embrace the unknown.,long,Green,Envy,Negative
I crave their ability to see the world through a different lens and appreciate new experiences.,crave,Green,Envy,Negative
I resent their seemingly effortless ability to break free from routine and embrace spontaneity.,resent,Green,Envy,Negative
I covet their ability to find joy in the simple things and appreciate the beauty of the world around them.,covet,Green,Envy,Negative
I envy their ability to connect with nature and find solace in the wilderness.,envy,Green,Envy,Negative
I long for their ability to find peace and tranquility in the midst of chaos.,long,Green,Envy,Negative
I crave their ability to escape the pressures of everyday life and reconnect with themselves.,crave,Green,Envy,Negative
I resent their seemingly effortless ability to find balance in their lives and make time for what truly matters.,resent,Green,Envy,Negative
"I covet their ability to create a life that is fulfilling, meaningful, and aligned with their values.",covet,Green,Envy,Negative
I envy their ability to find happiness from within and cultivate a sense of inner peace.,envy,Green,Envy,Negative
I long for their ability to appreciate the present moment and savor the good things in life.,long,Green,Envy,Negative
I crave their ability to radiate positivity and inspire others with their optimism.,crave,Green,Envy,Negative
I resent their seemingly effortless ability to overcome challenges and maintain a positive outlook on life.,resent,Green,Envy,Negative
I covet their ability to find gratitude in every situation and focus on the blessings they have.,covet,Green,Envy,Negative
I envy their ability to spread joy and laughter wherever they go.,envy,Green,Envy,Negative
I wish I was as lucky as them.,wish,Green,Envy,Negative
I wish I was as free as them.,wish,Green,Envy,Negative
I wish I was as confident as them.,wish,Green,Envy,Negative
I wish I was as charismatic as them.,wish,Green,Envy,Negative
I wish I was as charming as them.,wish,Green,Envy,Negative
I wish I was as witty as them.,wish,Green,Envy,Negative
I wish I was as humorous as them.,wish,Green,Envy,Negative
I wish I had their sense of style.,wish,Green,Envy,Negative
I wish I had their taste in music.,wish,Green,Envy,Negative
I am feeling calm and peaceful.,calm,Light Blue,Calmness,Neutral
I am feeling serene and tranquil.,serene,Light Blue,Calmness,Neutral
I am feeling at ease and relaxed.,ease,Light Blue,Calmness,Neutral
I am feeling cool and composed.,cool,Light Blue,Calmness,Neutral
I am feeling collected and in control.,control,Light Blue,Calmness,Neutral
I am feeling at peace with the world.,peace,Light Blue,Calmness,Neutral
I am feeling at one with myself.,one,Light Blue,Calmness,Neutral
I am feeling centered and grounded.,centered,Light Blue,Calmness,Neutral
I am feeling balanced and harmonious.,balanced,Light Blue,Calmness,Neutral
I am feeling at ease with myself and the world around me.,ease,Light Blue,Calmness,Neutral
I am feeling calm and at peace in the midst of chaos.,calm,Light Blue,Calmness,Neutral
I am feeling serene and tranquil even in the face of adversity.,serene,Light Blue,Calmness,Neutral
I am feeling at ease and relaxed even in the midst of stress.,ease,Light Blue,Calmness,Neutral
I am feeling cool and composed even in the face of anger.,cool,Light Blue,Calmness,Neutral
I am feeling collected and in control even in the midst of chaos.,collected,Light Blue,Calmness,Neutral
I am feeling at peace with the world even in the face of conflict.,peace,Light Blue,Calmness,Neutral
I am feeling at one with myself even in the face of loneliness.,one,Light Blue,Calmness,Neutral
I am feeling centered and grounded even in the midst of uncertainty.,centered,Light Blue,Calmness,Neutral
I am feeling balanced and harmonious even in the face of imbalance.,balanced,Light Blue,Calmness,Neutral
I am feeling at ease with myself and the world around me even in the midst of challenges.,ease,Light Blue,Calmness,Neutral
I am feeling calm and peaceful in the midst of nature.,calm,Light Blue,Calmness,Neutral
I am feeling serene and tranquil in the midst of beauty.,serene,Light Blue,Calmness,Neutral
I am feeling at ease and relaxed in the midst of comfort.,ease,Light Blue,Calmness,Neutral
I am feeling cool and composed in the midst of serenity.,cool,Light Blue,Calmness,Neutral
I am feeling collected and in control in the midst of peace.,collected,Light Blue,Calmness,Neutral
I am feeling at peace with the world in the midst of harmony.,peace,Light Blue,Calmness,Neutral
I am feeling at one with myself in the midst of tranquility.,one,Light Blue,Calmness,Neutral
I am feeling centered and grounded in the midst of balance.,centered,Light Blue,Calmness,Neutral
I am feeling balanced and harmonious in the midst of ease.,balanced,Light Blue,Calmness,Neutral
I am feeling at ease with myself and the world around me in the midst of contentment.,ease,Light Blue,Calmness,Neutral
I am feeling calm and peaceful in the midst of stillness.,calm,Light Blue,Calmness,Neutral
I am feeling serene and tranquil in the midst of quietness.,serene,Light Blue,Calmness,Neutral
I am feeling at ease and relaxed in the midst of calmness.,ease,Light Blue,Calmness,Neutral
I am feeling cool and composed in the midst of serenity.,cool,Light Blue,Calmness,Neutral
I am feeling collected and in control in the midst of peacefulness.,collected,Light Blue,Calmness,Neutral
I am feeling at peace with the world in the midst of tranquility.,peace,Light Blue,Calmness,Neutral
I am feeling at one with myself in the midst of stillness.,one,Light Blue,Calmness,Neutral
I am feeling centered and grounded in the midst of quietness.,centered,Light Blue,Calmness,Neutral
I am feeling balanced and harmonious in the midst of calmness.,balanced,Light Blue,Calmness,Neutral
I am feeling at ease with myself and the world around me in the midst of serenity.,ease,Light Blue,Calmness,Neutral
I am feeling calm and peaceful in the midst of solitude.,calm,Light Blue,Calmness,Neutral
I am feeling serene and tranquil in the midst of isolation.,serene,Light Blue,Calmness,Neutral
I am feeling at ease and relaxed in the midst of loneliness.,ease,Light Blue,Calmness,Neutral
I am feeling cool and composed in the midst of solitude.,cool,Light Blue,Calmness,Neutral
I am feeling collected and in control in the midst of isolation.,collected,Light Blue,Calmness,Neutral
I am feeling at peace with the world in the midst of loneliness.,peace,Light Blue,Calmness,Neutral
I am feeling at one with myself in the midst of solitude.,one,Light Blue,Calmness,Neutral
I am feeling centered and grounded in the midst of isolation.,centered,Light Blue,Calmness,Neutral
I am feeling balanced and harmonious in the midst of loneliness.,balanced,Light Blue,Calmness,Neutral
I am feeling at ease with myself and the world around me in the midst of solitude.,ease,Light Blue,Calmness,Neutral
I am feeling calm and peaceful in the midst of silence.,calm,Light Blue,Calmness,Neutral
I am feeling serene and tranquil in the midst of quietness.,serene,Light Blue,Calmness,Neutral
I am feeling at ease and relaxed in the midst of stillness.,ease,Light Blue,Calmness,Neutral
I am feeling cool and composed in the midst of peacefulness.,cool,Light Blue,Calmness,Neutral
I am feeling collected and in control in the midst of calmness.,collected,Light Blue,Calmness,Neutral
I am feeling at peace with the world in the midst of tranquility.,peace,Light Blue,Calmness,Neutral
I am feeling at one with myself in the midst of silence.,one,Light Blue,Calmness,Neutral
I am feeling centered and grounded in the midst of quietness.,centered,Light Blue,Calmness,Neutral
I am feeling balanced and harmonious in the midst of calmness.,balanced,Light Blue,Calmness,Neutral
I am feeling at ease with myself and the world around me in the midst of serenity.,ease,Light Blue,Calmness,Neutral
I am feeling peaceful and content with my life.,peaceful,Light Blue,Calmness,Neutral
"I am in a state of tranquility and serenity, even in the face of adversity.",tranquility,Light Blue,Calmness,Neutral
"I am feeling peaceful and at peace with myself, even in the midst of change.",peaceful,Light Blue,Calmness,Neutral
"I am in a state of calmness and relaxation, even in the face of uncertainty.",calmness,Light Blue,Calmness,Neutral
"I am feeling peaceful and content with my life, even with its ups and downs.",peaceful,Light Blue,Calmness,Neutral
"I am in a state of tranquility and serenity, even in the face of challenges.",tranquility,Light Blue,Calmness,Neutral
"I am feeling peaceful and at peace with myself, even in the midst of change.",peaceful,Light Blue,Calmness,Neutral
"I am in a state of calmness and relaxation, even in the face of uncertainty.",calmness,Light Blue,Calmness,Neutral
"I am feeling peaceful and content with my life, even with its imperfections.",peaceful,Light Blue,Calmness,Neutral
"I am in a state of tranquility and serenity, even in the face of negativity.",tranquility,Light Blue,Calmness,Neutral